{
  "ofp": "0.3",
  "site": { "id": "site_7bq2ln55", "domain": "blog.example.org", "name": "Example Blog" },
  "status": "accepting",
  "verified_domain": true,
  "basis": "voluntary",
  "payment": {
    "methods": [
      { "type": "opencollective", "label": "Open Collective", "url": "https://opencollective.com/example" }
    ]
  }
}
